{
  "$schema": "https://json-schema.org/draft/2020-12/schema",
  "$id": "orbital-contribution",
  "title": "Orbital Contribution",
  "description": "What each agent produces per round — typed findings, artifacts, cross-references, and self-review results.",
  "type": "object",
  "required": ["id", "opportunity_id", "agent_function", "round", "findings", "artifacts_produced", "cross_references", "self_review", "created_at"],
  "properties": {
    "id": {
      "type": "string",
      "pattern": "^contrib-.+-\\d{8}-\\d{6}$",
      "description": "Unique identifier: contrib-{function}-YYYYMMDD-HHMMSS"
    },
    "opportunity_id": {
      "type": "string",
      "pattern": "^opp-\\d{8}-\\d{6}$"
    },
    "agent_function": {
      "type": "string",
      "pattern": "^[a-z][a-z0-9-]*$",
      "minLength": 2,
      "maxLength": 50,
      "description": "Which orbital function produced this contribution"
    },
    "investigation_brief_ref": {
      "type": "string",
      "description": "Reference to the investigation track from the roster that this contribution addresses"
    },
    "round": {
      "type": "integer",
      "minimum": 1,
      "description": "Which round of investigation (1 = initial, 2+ = post-review revisions)"
    },
    "findings": {
      "type": "array",
      "minItems": 1,
      "items": {
        "type": "object",
        "required": ["id", "type", "content", "confidence", "source", "assumptions_addressed", "direction"],
        "properties": {
          "id": {
            "type": "string",
            "pattern": "^find-\\d{3}$"
          },
          "type": {
            "type": "string",
            "enum": ["evidence_candidate", "constraint", "opportunity", "risk", "prototype_insight", "measurement", "counter_signal"],
            "description": "What kind of signal this finding represents"
          },
          "content": {
            "type": "string",
            "minLength": 20,
            "description": "The finding itself — must explain WHY it matters"
          },
          "confidence": {
            "type": "number",
            "minimum": 0,
            "maximum": 1,
            "description": "Agent's confidence in this finding (0-1)"
          },
          "source": {
            "type": "string",
            "minLength": 5,
            "description": "Where this finding came from — data source, analysis method, prototype test"
          },
          "assumptions_addressed": {
            "type": "array",
            "items": { "type": "string" },
            "description": "Which opportunity assumptions this finding addresses"
          },
          "direction": {
            "type": "string",
            "enum": ["supports", "contradicts", "neutral"],
            "description": "Does this finding support or challenge the opportunity"
          }
        }
      },
      "description": "Typed findings from the investigation"
    },
    "artifacts_produced": {
      "type": "array",
      "items": {
        "type": "object",
        "required": ["path", "type", "description"],
        "properties": {
          "path": { "type": "string" },
          "type": {
            "type": "string",
            "enum": ["prototype", "spec", "experiment", "analysis", "wireframe", "model"]
          },
          "description": { "type": "string" }
        }
      }
    },
    "cross_references": {
      "type": "array",
      "items": {
        "type": "object",
        "required": ["references_contribution", "finding_id", "reason"],
        "properties": {
          "references_contribution": { "type": "string" },
          "finding_id": { "type": "string" },
          "reason": { "type": "string" }
        }
      },
      "description": "References to other agents' contributions"
    },
    "self_review": {
      "type": "object",
      "required": ["self_checked", "self_check_notes"],
      "properties": {
        "self_checked": {
          "type": "boolean",
          "description": "Did the agent self-check against quality criteria before submitting?"
        },
        "self_check_notes": {
          "type": "string",
          "minLength": 10,
          "description": "What the agent noted during self-check"
        },
        "reviewer": {
          "type": "string",
          "description": "Which reviewer agent reviewed this contribution (populated after independent review)"
        },
        "review_passed": {
          "type": "boolean",
          "description": "Did the independent review pass? (populated after independent review)"
        },
        "review_feedback": {
          "type": "string",
          "description": "Reviewer's feedback on the contribution (populated after independent review)"
        },
        "revisions_made": {
          "type": "array",
          "items": { "type": "string" },
          "description": "What changed based on review feedback (populated after revision round)"
        }
      },
      "additionalProperties": false,
      "description": "Two-step review: agent self-checks (required on initial write), then dedicated reviewer provides independent review (populated after review)"
    },
    "created_at": {
      "type": "string",
      "format": "date-time"
    }
  },
  "additionalProperties": false
}
