{
  "id": "contrib-design-20260405-120100",
  "opportunity_id": "opp-20260405-120000",
  "agent_function": "design",
  "round": 1,
  "findings": [
    {
      "id": "find-001",
      "type": "prototype_insight",
      "content": "A persistent grocery list with substitution preferences reduces cart abandonment by giving users control over the substitution decision before checkout, not during delivery.",
      "confidence": 0.7,
      "source": "Prototype testing with 3 synthetic personas (Weekly Basket Builder, Fresh-Obsessed, Quick-Run Shopper)",
      "assumptions_addressed": ["asm-001"],
      "direction": "supports"
    },
    {
      "id": "find-002",
      "type": "opportunity",
      "content": "Delivery slot visualization (showing confidence level per slot) is a low-effort, high-impact UX change that could address slot anxiety independently of the broader conversion funnel.",
      "confidence": 0.6,
      "source": "Competitive analysis of Instacart and Ocado slot UI patterns",
      "assumptions_addressed": ["asm-002"],
      "direction": "supports"
    },
    {
      "id": "find-003",
      "type": "risk",
      "content": "A full redesign of the grocery flow risks disrupting existing power users who have adapted to the current friction. Incremental changes may be safer.",
      "confidence": 0.5,
      "source": "Experience audit of current grocery flow",
      "assumptions_addressed": [],
      "direction": "neutral"
    }
  ],
  "artifacts_produced": [
    {
      "path": "artifacts/grocery-list-prototype-v1.html",
      "type": "prototype",
      "description": "Interactive prototype of persistent grocery list with substitution preferences"
    }
  ],
  "cross_references": [],
  "self_review": {
    "self_checked": true,
    "self_check_notes": "Verified solution approaches are genuinely different (persistent list vs slot visualization vs incremental UX). Prototype tests a real hypothesis about substitution control.",
    "reviewer": "design-reviewer",
    "review_passed": true,
    "review_feedback": "Findings are well-grounded in prototype testing. Risk finding about power user disruption is important but needs data validation.",
    "revisions_made": ["Added confidence levels to each finding", "Expanded source attribution for competitive analysis"]
  },
  "created_at": "2026-04-05T12:01:00Z"
}
