{
  "id": "contrib-design-20260405-120100",
  "opportunity_id": "opp-20260405-120000",
  "agent_function": "design",
  "round": 1,
  "findings": [
    {
      "id": "find-001",
      "type": "prototype_insight",
      "content": "A persistent grocery list with substitution preferences reduces cart abandonment by giving users control over the substitution decision before checkout.",
      "confidence": 0.7,
      "source": "Prototype testing with 3 synthetic personas (Weekly Basket Builder, Fresh-Obsessed, Quick-Run Shopper)",
      "assumptions_addressed": ["asm-001"],
      "direction": "supports"
    }
  ],
  "artifacts_produced": [],
  "cross_references": [],
  "self_review": {
    "self_checked": true,
    "self_check_notes": "Verified solution approaches are genuinely different. Prototype tests a real hypothesis about substitution control."
  },
  "created_at": "2026-04-05T12:01:00Z"
}
