{
  "id": "contrib-analyst-20260410-101500",
  "opportunity_id": "opp-20260410-100000",
  "agent_function": "analyst",
  "round": 1,
  "findings": [
    {
      "id": "find-001",
      "type": "evidence_candidate",
      "content": "The Deal Hunter segment represents 28% of MAU but only 8% of Pro subscribers, indicating significant untapped conversion potential compared to other segments.",
      "confidence": 0.85,
      "source": "Segment analysis from internal analytics dashboard, Q1 2026 data",
      "assumptions_addressed": ["asm-001"],
      "direction": "supports"
    },
    {
      "id": "find-002",
      "type": "counter_signal",
      "content": "Competitor gamification features (Careem Plus points, Noon VIP tiers) show declining engagement after 60 days — initial novelty wears off without deeper value hooks.",
      "confidence": 0.65,
      "source": "Competitive analysis of Careem Plus and Noon VIP programs, public app store reviews and social media sentiment",
      "assumptions_addressed": ["asm-002"],
      "direction": "contradicts"
    },
    {
      "id": "find-003",
      "type": "measurement",
      "content": "Market sizing: gamified savings features could address ~120K Deal Hunter MAU in UAE alone. At 20% conversion uplift, this represents ~8,400 additional Pro subscribers per quarter.",
      "confidence": 0.7,
      "source": "TAM calculation from segment data cross-referenced with Pro pricing model",
      "assumptions_addressed": ["asm-001"],
      "direction": "supports"
    }
  ],
  "artifacts_produced": [
    {
      "path": "artifacts/market.md",
      "type": "analysis",
      "description": "Market sizing and competitive landscape analysis for gamified loyalty features"
    }
  ],
  "cross_references": [],
  "self_review": {
    "self_checked": true,
    "self_check_notes": "Validated segment sizing against two data sources. Competitive analysis covers top 3 regional competitors. Counter-signal about declining engagement is well-sourced from public data."
  },
  "created_at": "2026-04-10T10:15:00Z"
}
